doi;author;title;year;abstract;journal
10.1075/lic.15016.sic;Eva Sicherl;A comparison of diminutive expressions in English and Slovene: as exemplified by Roald Dahl’s Matilda;2017;The article presents and compares ways of expressing diminution in English and Slovene nouns, verbs and adjectives with the aim of testing a hypothesis suggesting that Slovene uses diminutive forms more frequently than English. Depending on language typology, diminutiveness can be realized predominantly word-formationally or predominantly analytically. The hypothesis is tested against an analysis of diminutive forms used in Dahl’s Matilda and its Slovene translation, showing that Slovene indeed prefers to use diminutives more frequently than English. A tendency can be established for Slovene to form diminutives by word-formational means in the categories of noun and verb. In verbs, English tends towards neutrality of expression. Frequent use of multiple diminutiveness and the ability of analytic and synthetic diminutive forms to be freely interchangeable in Slovene testify to the strong presence of diminutive forms in the language system.;LANGUAGES IN CONTRAST
10.1075/lic.00009.lia;"Linxin Liang; Mingwu Xu";Guangrong Dai, Hybridity in Translated Chinese: A Corpus Analytical Framework;2018;;LANGUAGES IN CONTRAST
10.1075/lic.00010.cla;Jeroen Claes;Rosa E. Guzzardo Tamargo, Catherine M. Mazak, and M. Carmen Parafita Couto (eds). Spanish-English codeswitching in the Caribbean and the US;2018;;LANGUAGES IN CONTRAST
10.1075/lic.00001.eng;Renata Enghels;Extending the notion of near-synonymy: Studies in morphological, syntactic and pragmatic equivalence;2018;;LANGUAGES IN CONTRAST
10.1075/lic.00002.one;Paul O’Neill;Near-synonymy in morphological structures: Why Catalans can abolish constitutions  but Portuguese and Spanish speakers can’t;2018;"This article examines the concept of defectivity in the verbal system of Spanish, Portuguese and Catalan. Building on previous studies on defective verbs in Spanish and Portuguese I investigate why there are no such defective verbs in Catalan. I conclude that the structure of the verbal paradigm in Catalan non-first conjugation verbs is radically different from that of the other languages; Catalan verbs constitute paradigms which correspond to regular patterns of inflection whereas Spanish and Portuguese display non-predictable types of root allomorphy which require all non-first conjugation verbs to have a memorised form for the rhizotonic forms of the verb. Theoretically, this type of defectivity poses problems for models of inflectional morphology and suggests that the patterns of frequent verbs can become general rules for all verbs of a particular conjugation.";LANGUAGES IN CONTRAST
10.1075/lic.00003.bla;Jos? Luis Blas Arroyo;At the boundaries of linguistic convergence: Variation in presentational haber / haver-hi: A sociolinguistic comparative analysis of Spanish and Catalan grammars;2018;In this paper, we focus on an eventual convergence outcome (the pluralization of presentational haber/haver-hi) in the grammar of two Romance languages, Spanish and Catalan, which have been living side-by-side for centuries in Eastern Spain. Taking into account the sociolinguistic comparative method and on the basis of several representative corpora of the two languages in contact, the data from this research offer evidence that points to a notable congruence between the underlying grammars of both languages, which would, at least partially, account for a similar diffusion of these vernacular pluralizations. Moreover, some of the few cases of disagreement found can be explained on the basis of both internal (such as the existence of points of structural conflict in some verbal paradigms) and external factors (such as hypercorrection), which certain social groups particularly sensitive to normative pressure are more receptive to.;LANGUAGES IN CONTRAST
10.1075/lic.00004.cor;Alice Corr;‘Exclamative’ and ‘quotative’ illocutionary complementisers in Catalan, European Portuguese and Spanish: A study in Ibero-Romance syntactic ‘near-synonymy’;2018;The use of the Ibero-Romance complementiser que in non-embedded contexts with various illocutionary functions is argued to be non-trivially distinct from its canonical function as a marker of subordination. Interpretative and grammatical differences, and variation in the availability and clause-typing of non-embedded ‘exclamative’ and ‘quotative’ illocutionary que across Catalan, European Portuguese and Spanish provide evidence that the subordinating complementiser has been repurposed for the representation of pragmatic information in the complementiser systems of Ibero-Romance, a hypothesis supported by analogies drawn between illocutionary que and illocutionary functions of the interrogative complementiser si/se in Catalan and European Portuguese.;LANGUAGES IN CONTRAST
10.1075/lic.00005.koc;Anna Kocher;Epistemic and evidential modification  in Spanish and Portuguese: A quantitative approach;2018;This article focuses on three constructions in Spanish and Portuguese that contain epistemic and evidential modifiers. It proposes that these constructions can be analyzed as cases of near-synonymy. Two of them are attested cross-linguistically: in the first, the modifiers function as predicative adjectives in impersonal copula clauses, while in the second, they are sentential adverbs. In the third type of construction, typical of the languages under investigation, the modifiers are followed by the complementizer que and introduce root clauses. The first part of the article describes the interpretive contrasts between the three constructions. The modifiers receive a different (inter)subjective reading depending on the construction in which they appear. Additionally, they operate on different levels of (non-)at-issue meaning. The second part of the article presents a quantitative study that complements the insights from the first part. In this empirical study, the influence of the text type, the modifier and the language on the choice of construction is modeled statistically. The results support the idea that the constructions are stylistic near-synonyms since their choice is strongly determined by the text type they appear in.;LANGUAGES IN CONTRAST
10.1075/lic.00006.mar;Aur?lie Marsily;Directness vs. indirectness: A contrastive analysis of pragmatic equivalence  in Spanish and French request formulations;2018;The aim of this paper is to examine the cross-cultural differences between (in)direct Spanish and French request formulations, adopting a pragmatic approach. More specifically, this study focusses on pragmatic equivalences in request formulations in informal and educational contexts, in French and Spanish corpora. In order to do so, a taxonomy was developed, based on the literature and on the analysis of the Spanish and French corpora. The analysis of the data shows that, on the one hand, direct strategies are among the most frequent request formulations in both corpora and, on the other, some formulations are similar in Spanish and in French but that their pragmatic interpretation or their frequency differs.;LANGUAGES IN CONTRAST
10.1075/lic.00007.chr;Lucy Chrispin;Signe Oksefjell Ebeling and Hilde Hasselg?rd (eds).: Cross-Linguistic Perspectives on Verb Constructions;2018;;LANGUAGES IN CONTRAST
10.1075/lic.00008.leu;Torsten Leuschner;Pius ten Hacken (ed.). The Semantics of Compounding;2018;;LANGUAGES IN CONTRAST
10.1075/lic.17.2.01buy;Lieven Buysse;Question tags in translation: An investigation into the translatability of English question tags into Dutch;2017;Canonical question tags feature prominently in spoken English, where they display great versatility. At face value they are meant to elicit a response from a co-participant in the form of (dis)agreement with the proposition to which the tag has been added. Their pragmatic scope is, however, considerably broader: they serve as politeness strategies but also emphasize the speaker’s convictions or mark accusations. Like many other languages, Dutch does not have a similar structure, which raises questions as to what devices Dutch employs to serve the same purpose as question tags. This contrastive study examines such correspondents in a parallel corpus of English novels and their Dutch translations. Three structures can be identified: pragmatic markers, clause-final parentheticals and combinations of these. The data indicate a preference for pragmatic markers (most notably h? and toch), which predominantly appear either as invariant tags or clause-medially, indicating subtle shifts in utterance interpretation.;LANGUAGES IN CONTRAST
10.1075/lic.17.2.02haa;Florian Haas;Motivating an English-German contrast in word-formation;2017;German has a set of nouns which are derived from a combination of a preposition and the reciprocal pronoun einander ‘one another’. Compounds of this type are strikingly absent from English, although all the components that enter the German formations are available in English, as well. This paper takes a closer look at the relevant word-formation patterns, focusing on compounding and different types of conversion, also taking into account the diachrony of reciprocal pronouns (einander in German and each other/one another in English) and the role of morphological schemas. It will be argued that for explaining the lack of English nouns corresponding to the German nouns under discussion contrasts in the history and the grammar of reciprocals are less relevant than (i) the availability of well-entrenched word-formation patterns, and (ii) the more significant role of ‘syntactic conversion’ in German.;LANGUAGES IN CONTRAST
10.1075/lic.17.2.03lan;Laure Lansari;I was going to say / j’allais dire as discourse markers in contemporary English and French;2017;This paper investigates two emerging discourse markers based on verbs of saying in English and French – I was going to say and j’allais dire. Relying on various comparable corpora, the author shows that the markers under scrutiny have developed a similar use as “reduced parenthetical clauses” mitigating discourse. The corpus study also reveals an interesting difference, namely that I was going to say stands as a topical transition marker in some of its uses. It is thus hypothesized that the two markers do not exactly follow the same pragmaticalisation path.;LANGUAGES IN CONTRAST
10.1075/lic.17.2.04dic;James Dickins;The pervasiveness of coordination in Arabic, with reference to Arabic>English translation;2017;"This article analyses aspects of the greater use of coordination in Modern Standard Arabic as compared to English, illustrating this through Arabic>English translation. It argues that Arabic ‘favours’ coordination linguistically, textually and rhetorically, as follows: 1. The linguistic resources of Arabic favour coordination while those of English favour subordination – whether these are lexical (Arabic ? wa- and ? fa- vs. English ‘and’), or semantic (the possibility of backgrounding coordinated clauses in Arabic compared to the marginality of backgrounded coordinated clauses in English); 2. Accompanying Arabic textual norms, e.g. (near-)synonym repetition and chained coordination, favour coordination while those of English favour subordination; 3. Further associated ‘rhetorical semantic’ uses of coordination are found in Arabic, e.g. hyperonym-hyponym repetition and associative repetition, which do not exist in English; 4. These extended usages further entrench coordination as a norm in Arabic as compared to English.";LANGUAGES IN CONTRAST
10.1075/lic.17.2.05fil;Luna Filipovi?;Applied Language Typology: Applying typological insights in professional practice;2017;In this paper we introduce and outline a new research area, Applied Language Typology (ALT). ALT builds on fundamental typological findings in morphology, syntax and semantics. ALT examines the attested and potential practical consequences of these contrasts for different professional contexts of communication, such as translation, the law and second language learning and teaching. We propose three general organising principles that underlie ALT, illustrating how these principles enable us to identify exact points of language contrasts that result in significant practical difficulty, and we suggest future directions in ALT research for the benefit of academics and language practitioners.;LANGUAGES IN CONTRAST
10.1075/lic.17.2.06ves;Rainer Vesterinen;Mood choice in complements of Spanish comprender and Portuguese compreender (‘understand’) – distribution and meaning;2017;The present paper analyzes the occurrence of indicative and subjunctive complements of the verbs comprender (Spanish) and compreender (Portuguese) in European Spanish and European Portuguese. A quantitative analysis based on 400 occurrences of the complements randomly selected from the newspaper genre shows that the indicative mood occurs more frequently than the subjunctive mood in both languages, although the subjunctive mood is more frequent in the Portuguese corpus than in the Spanish one. The analysis also shows that the occurrence of the subjunctive complement is highly restricted to contexts in which the subject of the main clause verb is either 1st person or 3rd person singular. From the theoretical perspective of Cognitive Grammar, the mood alternation is explained by the concept of dominion, i.e. the indicative complement designates an event that is located within the conceptualizer’s epistemic dominion, whereas the subjunctive complement designates an event that is located outside the conceptualizer’s dominion of effective control.;LANGUAGES IN CONTRAST
10.1075/lic.17.2.07dec;Sofie Decock;Svenja Kranich, Contrastive Pragmatics and Translation. Evaluation, Epistemic Modality and Communicative Styles in English and German.;2017;;LANGUAGES IN CONTRAST
10.1075/lic.17.2.08weg;Rebekah Wegener;Ilka Fl?ck, Requests in American and British English: A contrastive multi-method analysis;2017;;LANGUAGES IN CONTRAST
10.1075/lic.16.2.01ani;Sosei Aniya;An acoustic analysis of flaps in American English and Japanese: Occlusion duration and devoicing;2016;"This paper advances a phonetic analysis of the American English flap together with the American English lateral liquid in contrast to the Japanese flap, thereby revealing similarities and differences among the three sounds. After a brief review of previous studies of the American English flap and the Japanese flap, an acoustic experiment involving the three sounds is provided. The results of the experiment produce three findings which have not been recognized in previous studies: (i) the Japanese flap gets devoiced; (ii) the American English flap is similar to the Japanese flap in occlusion duration and devoicing; (iii) the American English flap and the Japanese flap are dissimilar to the American English lateral liquid, which is longer in duration than the first two, and it rarely gets devoiced.";LANGUAGES IN CONTRAST
10.1075/lic.16.2.02kef;"Stavroula Kefala; Maria Sidiropoulou";Shaping the glo/cal in Greek–English tourism advertising: A critical cosmopolitan perspective;2016;The study explores mediated identity construction on the local and global stage, in Greek-English tourism material. It examines sample data, drawing on the Greek National Tourism Organization website, to identify shifts in the Greek and English versions of the data using Swain’s (2009) model of critical cosmopolitan orientations. The critical cosmopolitan framework is shown to be instrumental in revealing identity construction tendencies in the two versions, which shape the interaction of host and visitor, the destination and the travel experience. Findings raise awareness of how identities are perceived and constructed in the tourism business and of the formative potential of these practices on discourses. They also have consequences for training practices in tourism advertising, the translation of identities and self-representation practices. Results are expected to carve a path towards raising awareness of the complexities involved in cultural communication and the construction of messages.;LANGUAGES IN CONTRAST
10.1075/lic.16.2.03rab;Rosa Rabad?n;Proposals in meeting minutes: An English-Spanish corpus-based study;2016;This paper provides an analysis of the lexico-grammatical features used in English and Spanish in the rhetorical part pertaining to the proposal step of a particular genre, meeting minutes. The results have been used in the construction of a computerized writing aid designed to assist Spanish writers when writing minutes in English. Corpus-based contrast reveals that minutes share a common rhetorical structure but show differences in the lexico-grammatical choices associated with the various rhetorical parts. Proposals are conveyed both in English and Spanish by means of lexical verbs, deverbal constructions and certain clause types. Cross-linguistic differences are in the choice of tense, mood and voice. The analysis also suggests different degrees of conventionalization of these resources in the two languages. Results form part of a linguistic prototype that includes three main components: rhetorical information in Spanish, grammatical strings in English and bilingual genre/move restricted glossaries.;LANGUAGES IN CONTRAST
10.1075/lic.16.2.04roz;Agata Rozumko;Adverbs of certainty in a cross-linguistic and cross-cultural perspective: English-Polish;2016;The increasing interest in cross-linguistic research in the area of epistemic modality calls for developing a common theoretical framework within which the inventories and uses of epistemics can be compared across languages. The aim of this study is to compare the repertoires of English and Polish adverbs of certainty taking as the starting point the classification employed by Simon-Vandenbergen and Aijmer (2007). It attempts to examine the validity of their typology for cross-linguistic studies with reference to data from English and Polish. The uses of English and Polish epistemics are illustrated with examples from the British National Corpus and the PWN corpus, respectively. Because the means of expressing epistemic modality differ both the cross-linguistically and cross-culturally, the findings are placed in a cross-cultural perspective.;LANGUAGES IN CONTRAST
10.1075/lic.16.2.05zuf;Sandrine Zufferey;Discourse connectives across languages: Factors influencing their explicit or implicit translation;2016;Coherence relations linking discourse segments can be communicated explicitly by the use of connectives but also implicitly through juxtaposition. Some discourse relations appear, however, to be more coherent than others when conveyed implicitly. This difference is explained in the literature by the existence of default expectations guiding discourse interpretation. In this paper, we assess the factors influencing implicitation by comparing the number of implicit and explicit translations of three polysemous French connectives in translated texts across three target languages: German, English and Spanish. Each connective can convey two discourse relations: one that can easily be conveyed implicitly and one that cannot be easily conveyed implicitly in monolingual data. Results indicate that relations that can easily be conveyed implicitly are also those that are most often left implicit in translation in all target languages. We discuss these results in view of the cognitive factors influencing the explicit or implicit communication of discourse relations.;LANGUAGES IN CONTRAST
10.1075/lic.16.2.06weg;Rebekah Wegener;Teun A. van Dijk.  Discourse and Knowledge: A Sociocognitive Approach Cambridge/United Kingdom:  Cambridge University Press,  2014. v + 400?pp.  ISBN 978-1-107-41655-0;2016;;LANGUAGES IN CONTRAST
10.1075/lic.16.2.07xu;"Hai XU; Ziyue Chen";Ruihua Zhang.  Sadness Expressions in English and Chinese: Corpus Linguistic Contrastive Semantic Analysis London/New Delhi/New York/Sydney:  Bloomsbury,  2014. xii + 241?pp.  ISBN 978-1-4725-1066-2;2016;;LANGUAGES IN CONTRAST
10.1075/lic.16.1.01mur;Silvia Murillo;Reformulation markers and polyphony: A contrastive English–Spanish analysis;2016;"Reformulation markers (RMs) — in other words, that is, that is to say, i.e. and namely in English, and es decir, o sea, esto es and a saber in Spanish — are used to articulate different voices (Ducrot, 1984) or points of view (Anscombre, 1990; N?lke et al., 2004) in discourse. This paper offers a qualitative and quantitative analysis of the RMs found in a corpus of journalistic English and Spanish according to their different polyphonic arrangements. The theoretical framework used is a combination of insights from Relevance Theory — to explain the general role and the specific functions of RMs in the two languages —, and the Theory of Argumentation in Language — to account for their polyphonic meaning. The results show that instances of a high degree of polyphony are generally associated with particular discourse processes introduced by RMs, related to more interpretive uses such as definition, conclusion and consequence. However, significant differences emerge in the comparison of the specific RMs in English and in Spanish. Although the markers are often regarded as synonyms within each language or directly translatable from one language to another, their polyphonic potential may be considered a differentiating element between some of them.";LANGUAGES IN CONTRAST
10.1075/lic.16.1.02per;Mar?a P?rez Blanco;The construction of attitudinal stance: A corpus-based contrastive study of negative evaluative adjectives in English and Spanish opinion discourse;2016;This paper is a corpus-based contrastive study of the realization of negative attitudinal stance in English and Spanish discourse through the use of evaluative adjectives. The main aim of the study is to analyse and compare the grammatical patterns in which negative evaluative adjectives occur in each language and discuss the observed cross-linguistic differences in terms of the effects that alternative linguistic realizations have in the construction of evaluative discourse. The working procedure follows a contrastive analysis methodology: description of empirical data, juxtaposition and contrast. The descriptive data have been extracted from a large comparable corpus of English and Spanish newspaper opinion discourse. The study has revealed interesting similarities and differences in the construction of Attitude in each language, which are inferred by contrasting its surface structural features.;LANGUAGES IN CONTRAST
10.1075/lic.16.1.03fer;Jes?s Fern?ndez-Dom?nguez;A morphosemantic investigation of term formation processes in English and Spanish;2016;Driven by a shortage of studies on the morphosemantics of word-formation from a contrastive perspective, this article examines 200 English and Spanish terms from the olive oil industry with the aim of shedding light on their linguistic nature. This is achieved by use of a corpus which makes it possible to retrieve the units and their contexts from specialised texts. Besides considering the derivational features of the relevant terminogenesic processes, this investigation considers their semantic characteristics and connects the terms’ formal and meaning aspects. This, in turn, allows observing the close relationship between morphology and semantics in terminological spheres, which is directly linked with the role of these units as a tool for specialised communication. Once the morphosemantic features of the terms have been fully accounted for in English and Spanish individually, a comparison is drawn between the two languages in order to spot and describe similarities and differences.;LANGUAGES IN CONTRAST
10.1075/lic.16.1.04lev;Natalia Levshina;Verbs of letting in Germanic and Romance languages: A quantitative investigation based on a parallel corpus of film subtitles;2016;This study compares eleven verbs of letting in six Germanic and five Romance languages. The aim of this paper is to pinpoint the differences and similarities in the semasiological variation of these verbs, both across and within the two language groups they represent. The results of a Multidimensional Scaling analysis based on a parallel corpus of film subtitles show that the verbs differ along several semantic dimensions, such as letting versus leaving, factitive versus permissive causation, as well as modality and discourse function. Although the main differences between the verbs lend themselves to a genealogical interpretation (Germanic vs. Romance), a distributional analysis of constructional patterns in which the verbs occur reveals that these differences are in fact distributed areally, with a centre and a periphery.;LANGUAGES IN CONTRAST
