doi;author;title;year;abstract;journal
10.1075/lic.7.2.09han;"Silvia Hansen-Schirra; Stella Neumann; Erich Steiner";Cohesive explicitness and explicitation in an English-German translation corpus;2007;Explicitness or implicitness as assumed properties of translated texts and other texts in multilingual communication have for some time been the object of speculation and, at a later stage, of more systematic research in linguistics and translation studies. This paper undertakes an investigation of explicitness/implicitness and related phenomena of translated texts on the level of cohesion. A corpus-based research architecture, embedded in an empirical research methodology, will be outlined, and first results and possible explanations will be discussed. The paper starts with a terminological clarification of the concepts of ‘explicitness’ and ‘explicitation’ in terms of dependent variables to be investigated. The two terms — and their usage by other scholars — will be discussed. An electronic corpus will then be described which provides the empirical data and techniques for information extraction. For the investigation carried out using our corpus, indicators will then be derived on the basis of which operationalizations and hypotheses can be formulated for patterns of explicitation occurring between source and target texts. Some initial results relating to cohesive explicitness and explicitation in the data will be presented and discussed, with particular attention being paid to the areas of ‘reference’, ‘substitution‘, ‘ellipsis’, ‘conjunction’, and ‘lexical cohesion’. First attempts will also be made at explaining the findings.;LANGUAGES IN CONTRAST
10.1075/lic.7.2.10kun;Kerstin Kunz;A method for investigating coreference in translations and originals;2007;Coreference is one essential strategy of coherence and cohesion as it establishes connectivity in texts. This connection is evoked by linguistic devices on the text surface but has to be interpreted mentally as a relation between extralinguistic referents. Since translators are concerned with the reception of connectivity in source texts and the production of the same kind of connectivity in target texts coreference is an important process taking place in translation. The present paper deals with the elaboration of a method for investigating nominal coreference in originals and translations. In order to build parameters for the empirical analysis of coreference in English and German corpora we provide an overview over various mechanisms affecting the creation of coreference relations in source and target texts. We take account of linguistic as well as extralinguistic aspects as interdependent and interacting factors potentially causing shifts in coreference. The model we establish on the basis of these considerations allows us to investigate nominal coreferring expressions as well as analyse the relation of reference identity created between these expressions. Hence, our model facilitates exhaustive research on a very fine-grained scale. It allows us to capture differences on the lexicogrammatical as well as on a semantic and conceptual level and, thus, paves the way for interpretation on a more conceptual level.;LANGUAGES IN CONTRAST
10.1075/lic.7.2.12and;Gisle Andersen;Karin Aijmer & Anne-Marie Simon-Vandenbergen (eds.).  Pragmatic Markers in Contrast Oxford:  Elsevier,  2006. ix+257?pp.  ISBN 978-0-08-044676-9ISBN-10 0-08-044676-0 [Studies in Pragmatics series, 2].;2007;;LANGUAGES IN CONTRAST
10.1075/lic.7.2.13bau;Nicole Baumgarten;Erich Steiner.  Translated Texts: Properties, Variants, Evaluations Frankfurt am Main, Berlin, Bern, Bruxelles, New York, Oxford, Wien:  Peter Lang,  2004. 192?pp.  ISBN 3-631-52560-5 [Saarbr?cker Beitr?ge zur Sprach- und Translationswissenschaft Band, 4].;2007;;LANGUAGES IN CONTRAST
10.1075/lic.7.2.14kar;Elena Karagjosova;Elena Yakovleva.  Deutsche und russische Gespr?che. Ein Beitrag zur interkulturellen Pragmatik Niemeyer,  2004. IX + 431?pp.  ISBN 3-484-31251-3 [Germanistische Linguistik series, 251].;2007;;LANGUAGES IN CONTRAST
10.1075/lic.7.1.02lop;"Bel?n L?pez Arroyo; Mart?n J. Fern?ndez Antol?n; Rosario de Felipe Boto";Contrasting the rhetoric of abstracts in medical discourse: Implications and applications for English/Spanish translation;2007;The present study aims at offering a contrastive analysis framework for the specific textual patterns of the expert-to-expert communicative setting from a semantic and a functional approach. Our methodology tries to identify patterns of behaviour in one of the genres that might be said to be exclusive of expert-to-expert discourse in medicine: abstracts. By means of describing regularities, differences in the way information is distributed will be pinpointed. Since textual realizations have been agreed to bridge the distance between the semantic and the functional component, cohesion will be analyzed both as a semantic marker and as an indicator of information distribution — pragmatic marker — according to functional constraints. ‘Ad hoc’ comparable and translation corpora have been built, extracted from medical journals with a significant impact. Intra and interlingual analysis of those corpora has been carried out to attain a comprehensive description of textual patterns from the above mentioned semantic, formal and functional parametrical levels.;LANGUAGES IN CONTRAST
10.1075/lic.7.1.03lab;Bel?n Labrador;Contrasting ways of expressing restriction in English and Spanish and suggesting translational options into Spanish;2007;The purpose of this paper is to present the findings of a corpus-based contrastive study on a semantic function — restriction — and their applicability to translation. A number of restrictive elements in the two languages involved, English and Spanish, have been selected as search words and their behaviours have been analyzed on the basis of their textual environments. Apart from an overall description of meanings and uses, the article aims at verifying a linguistic hunch: cognates and also word-forms coming from the same lexeme were intuitively considered to differ more than might be expected, which has altogether been proved by the data found. Finally, a series of correspondences are suggested as translational options into Spanish for the most frequent uses and co-occurrences of the English elements.;LANGUAGES IN CONTRAST
10.1075/lic.7.1.04pit;Mirna Pit;Cross-linguistic analyses of backward causal connectives in Dutch, German and French;2007;The Dutch, German and French languages display a variety of regularly used connectives all of which introduce causes, arguments or reasons, such as Dutch omdat, want and aangezien, German weil, denn and da, and French parce que, car and puisque. Why should these languages have different connectives to express the notion of backward causality? The central argument developed in this article is that the use of these connectives is dependent on the degree of subjectivity associated with the causal relation. The pre-eminence of this account with respect to prior accounts of the uses of these connectives is established on the basis of a series of corpus analyses. The outcomes show that the degree of subjectivity of the main participant involved in the causal relation strongly predicts the occurrence of one or another connective. A distinction can be made between objective connectives like omdat and doordat, parce que and weil on the one hand and subjective connectives like want and aangezien, car and puisque and denn and da on the other hand. No differences between the subjective connectives aangezien/want, puisque/car and denn/da could be observed in terms of subjectivity, but additional frequency data and analyses of translation practices revealed promising directions for supplementary explanations.;LANGUAGES IN CONTRAST
10.1075/lic.7.1.05van;Kristel Van Goethem;French and Dutch preverbs in contrast: A case study of French sur- and Dutch op- and over-;2007;French sur and Dutch op (“on, upon”) can be a considered matching pair when they are used as prepositions: e.g. le livre sur la table/het boek op de tafel (“the book on the table”). However, used as prefixes, or in particular as preverbs, the similarities between sur- and op- seem to be much weaker. Instead, sur- corresponds more often to over-: e.g. surestimer quelque chose/iets overschatten (“to overestimate something”). From the analysis of a bilingual dictionary, we will investigate this phenomenon. At a morpho-syntactic level, on the one hand, we will show that French and Dutch preverbs appear in different types of constructions. At the semantic level, on the other hand, we will demonstrate that prepositions in preverbal use can develop new, often aspectual, meanings, but that this re-semanticization process does not necessarily follow the same paths in French and Dutch.;LANGUAGES IN CONTRAST
10.1075/lic.7.1.07stu;Michael Stubbs;Dirk Siepmann.  Discourse Markers Across Languages. A Contrastive Study of Second-level Discourse Markers in Native and Non-native Text with Implications for General and Pedagogic Lexicography London and New York:  Routledge,  2005xi + 257.   ISBN 0-415-34949-4;2007;;LANGUAGES IN CONTRAST
10.1075/lic.7.1.08def;Bart Defrancq;Agn?s Celle.  Temps et modalit?. L’anglais, le fran?ais et l’allemand en contraste Bern:  Peter Lang,  2006. viii + 200?p.  ISBN 3-03910-759-3;2007;;LANGUAGES IN CONTRAST
10.1075/lic.7.1.09kra;Wolf-Dieter Krause;Hartmut E.?H. Lenk & Andrew Chestermann (eds.).  Pressetextsorten im Vergleich – Contrasting Text Types in the Press Hildesheim, Z?rich, New York:  Olms,  2005. 387?pp.  ISBN 3-487-12941-8 [Germanistische Linguistik. Monographien, 17].;2007;;LANGUAGES IN CONTRAST
10.1075/lic.6.2.02pus;"Regina Pustet; Juliana Wijaya; Than Than Win";Progressives in typological perspective;2006;The category of progressive is known for the notorious difficulties of definition it poses not only within individual languages, but for general theories of aspect as well. A particularly challenging problem is the fact that in any one language, there seem to be lexemes that block progressive marking (such as the verbs ‘to know’ and ‘to understand’ in English). On the basis of comprehensive lexical samples from five languages, this study attempts to shed some light on the semantic factors governing the acceptability of progressive markers. This results in a modified outlook on the progressive.;LANGUAGES IN CONTRAST
10.1075/lic.6.2.03myh;John Myhill;Semantic parameters of vision words in Hebrew and English;2006;English and Hebrew use sharply differing systems for categorizing the meanings of words referring to vision. In English, the relevant parameters of meaning relate to whether information has been visually recorded and registered and what type of image was captured (a still picture, a moving picture, a close-up, etc.). In Hebrew, on the other hand, vision words code whether the information which has been recorded is particularly significant to the subject, and, if so, how (intellectually, personally, etc.).;LANGUAGES IN CONTRAST
10.1075/lic.6.2.04rab;Rosa Rabad?n;Modality and modal verbs in contrast: Mapping out a translation(ally) relevant approach English-Spanish;2006;This paper addresses the question of how English and Spanish encode the modal meanings of possibility and necessity. English modals and Spanish modal periphrases emerge as ‘cross-linguistic equivalents’ in this area. Data from two monolingual ‘comparable’ corpora — the Bank of English and CREA — reveal (i) differences in grammatical conceptualization in the English and the Spanish traditions and (ii) the relative inadequacy of classifications of modality for a translation-oriented contrast in this area. An English-Spanish contrastive map of the semantics (and expressive means) of modality will be an effective way to make relevant and accurate cross-linguistic information available. It is also the first step towards identifying potential translation pitfalls.;LANGUAGES IN CONTRAST
10.1075/lic.6.2.05ram;Noelia Ram?n Garc?a;Mapping meaning onto form: A corpus-based contrastive study of nominal modification in English and Spanish;2006;This paper is a corpus-based contrastive study of one particular semantic area — the modification of nouns — and the grammatical structures available in English and Spanish to actualize this particular meaning within the scope of the NP. Two large monolingual reference corpora, one in each language, have been used to extract the empirical data on which to base the analysis. A functional approach has been followed, starting from perceived similarities in meaning and trying to reveal the subtle links between particular semantic functions and the structures most commonly employed by native speakers of the two languages to convey those semantic functions. The working procedure will be described in detail, from the data selection process, to the description, juxtaposition and final contrast. This paper presents part of the contrastive results found in a larger study (Ram?n 2003), and shows the appropriateness of the methodology employed in order to obtain contrastive data useful in applied areas such as foreign language teaching, and, especially, in the field of translation.;LANGUAGES IN CONTRAST
10.1075/lic.6.2.07and;Henning Andersen;Heike Wiese.  Numbers, Language, and the Human Mind Cambridge:  University Press,  2003. xi + 346?pp.  ISBN 0 521 83182 2;2006;;LANGUAGES IN CONTRAST
10.1075/lic.6.1.02wil;Ian A. Williams;Towards a target-oriented model for quantitative contrastive analysis in translation studies: An exploratory study of theme–rheme structure in Spanish-English biomedical research articles;2006;This paper describes the design of a 192-text Spanish-English specialized corpus of biomedical research articles (RAs) divided into three 64-text subcorpora (English texts, their corresponding Spanish translations, and Spanish comparable texts) for use in quantitative contrastive analysis. The paper also presents an exploratory study analysing theme–rheme structure in these subcorpora. Two definitions of theme were used: Halliday’s ideational theme and preverbal theme (i.e., all clause constituents before the finite verb of the main clause). The study adopted a target-oriented approach and assessed the acceptability of the translated texts with regard to the statistical norm of the comparable native-speaker Spanish subcorpus. Statistically significant differences were found for marked theme and its different syntactic manifestations (prepositional phrase adjunct and subordinate clauses) and there was evidence of a different thematic distribution within the semantic category person (researcher, patient, first person). The most striking results were found for different measures of theme length, suggesting a consistent information overload in the thematic zone in the whole RA and in the individual rhetorical sections except for the Introduction. The translated texts occupy a kind of no-man’s land half-way between the source articles and the independently created Spanish RAs. A refined three-stage model of the study design is proposed for future target-oriented quantitative and qualitative research into translation.;LANGUAGES IN CONTRAST
10.1075/lic.6.1.03smi;Karen Smith;By any other name: A study of brand name transfer from English-language to Russian-language printed advertisements;2006;The brand name is one of the most important devices for marketing a product. Western companies spend vast sums of money devising brand names that convey the positive characteristics of products marketed on the strength of their image. Many of the brand names patented are complex linguistic units, using aspects of phonology, orthography, morphology, syntax and semantics to make names memorable. These names use language to impact on readers and therefore have transferable meanings. This article analyses the linguistic devices in a corpus of English language adverts and investigates which translation strategies are employed when the adverts are transferred into Russian. It argues that the transfer process is more complex than previous literature has suggested and that although the original meaning is often not maintained after transfer, brand names in the target adverts carry new connotations which are appealing due to the target audience’s expectations.;LANGUAGES IN CONTRAST
10.1075/lic.6.1.04cos;Christelle Cosme;Clause combining across languages: A corpus-based study of English-French translation shifts;2006;This study explores clause combining in English and French, with special emphasis on the relationship between and/et-coordination and subordination. More precisely, the claim that English shows a strong preference for coordination while French makes more intensive use of subordination is tested against bilingual corpus data, viz. a comparable corpus of original texts and a bidirectional translation corpus. The study shows that the number of shifts from coordination to subordination is higher in translations from English into French than in translations from French into English. This finding lends strong support to the initial hypothesis.;LANGUAGES IN CONTRAST
10.1075/lic.6.1.05xia;"Richard Xiao; Tony McEnery; Yufang Qian";Passive constructions in English and Chinese: A corpus-based contrastive study;2006;This article combines the corpus-based and contrastive approaches, seeking to provide a systematic account of passive constructions in two typologically distinct languages, namely British English and Mandarin Chinese. We will first explore, on the basis of written and spoken corpus data, a range of characteristics of passives in the two languages including various passive constructions, long vs. short passives, semantic, pragmatic and syntactic features as well as genre variations. On the basis of this exploration, passive constructions in the two languages are contrasted in a structured way. Methodologically, this study demonstrates that comparable monolingual corpora can be exploited fruitfully in contrastive linguistics.;LANGUAGES IN CONTRAST
10.1075/lic.6.1.06fil;Luna Filipovi?;Weaving the web of meaning;2006;Talmy’s (1985) typology proposes a classification of languages on the basis of their lexicalization patterns. All languages exhibit the tendency to code either manner or path of motion in the verb, and thus are divided accordingly into two main typological groups. The fact that languages code components of a motion event differently is therefore not a novelty, and it is only the point of departure in this paper. The aim here is to account for why these differences in lexicalization may occur. Many, if not all, languages make use of both patterns in expressions of motion events, and the reasons why one is more prominent and favoured than the other and on what occasions is the subject of the present discussion. Extensive data from Serbian/Croatian is presented in a contrastive setting in order to highlight the claim that the typology is best seen as a cline rather than a dichotomy. Two original hypotheses that explain the use of patterns in Serbian/Croatian are put forward, with the possibility to apply them further in analyses of other languages. It will be observed that the mechanism of lexicalization can be explained only after all the levels where meaning is conveyed in a language, namely morphology, syntax and semantics, are subjected to an analysis in a unifying fashion. Moreover, a network of the crucial spatial and temporal parameters is suggested here in order to distinguish event types and determine the language-specific means that reflect those event differences. Particular attention has been paid to a phase in motion events termed moment-of-change, which is notably absent from the relevant discussions in the literature. Another important contribution is the emphasis on the importance of deixis in the lexicalization of motion events, which has not been given the attention it deserves.;LANGUAGES IN CONTRAST
10.1075/lic.5.2.02cel;Agn?s Celle;The French future tense and English will as markers of epistemic modality;2006;The future tense in French and the modal auxiliary will in English can both express conjecture. This use is generally considered marginal compared to that of referring to future time. A unified analysis of the French future tense and of English will needs, however, to be able to account for the former. In this paper I attempt to show how this particular modal value is intrinsically related respectively to the tense system of French and to the modal system of English and consequently why no real correspondence may be posited between the two languages, the future of conjecture being seldom translated by will and vice versa.;LANGUAGES IN CONTRAST
10.1075/lic.5.2.03lop;"Ana Rojo; Javier Valenzuela";Verbs of sensory perception: An English-Spanish comparison;2006;Slobin (1996, 1997) has pointed out the differences between Spanish and English verbs of motion with regard to the expression of elements such as “Path of motion” or “Manner of motion”. Generally speaking, English verbs incorporate manner to their core meaning while Spanish verbs tend to incorporate Path, expressing Manner by means of an additional complement. Comparing English motion events and their translation into Spanish in several novels, Slobin found out that only 51% of English manner verbs were translated into Spanish manner verbs (Slobin 1996), the rest being neutralized or omitted. In this work, we apply Slobin’s analysis to sensory verbs of perception in English and Spanish. Our paper analyzes the conflation patterns of sensory verbs of perception in English and Spanish in order to investigate possible changes in the informational load during the translation process. For this purpose, we have extracted 200 sensory verbs of perception from two English and two Spanish novels and their respective translations. The paper examines instances of gain or loss of information during the translation process, as well as whether the translation shifts provide evidence for a difference in the way the perception event is structured in both languages;LANGUAGES IN CONTRAST
10.1075/lic.5.2.04xu;Jie Xu;Possessor raising in Chinese and Korean;2006;"A possessor NP may move out from the Spec position of a containing NP in some Asian languages such as Chinese and Korean, yielding the so-called ‘Possessor Raising Construction’. From the perspective of a syntactic theory based on principles and parameters of Universal Grammar, rather than on differing sets of rules for different particular languages, we in this article argue that the diverse Possessor Raising phenomena can well be subsumed along with ‘Passivization’ and ‘Subject Raising’ under the general syntactic process of ‘NP Movement’. The movement of Possessor Raising is driven by a functional motivation, which is to separate the possessor NP from the possession NP in order to emphasize the former. It has been demonstrated that the operation of Possessor Raising is well under the constraint of UG principles in interaction with independently explainable language-particular properties, in particular, it is mainly determined by the following three factors: (1) Whether the raised possessor NP can be properly Case-marked in its new site; (2) Whether the nominal residue left behind by the NP movement can be Case-marked; and (3) Whether other applicable conditions on movement such as the Subjacency can be satisfied. Most of our arguments are constructed on the basis of the analysis of a whole set of comparable language phenomena from Chinese, Korean and English, and those phenomena, most of which are well observed in the literature, are recast and explained in a very much principled way.";LANGUAGES IN CONTRAST
10.1075/lic.5.2.06har;Andrew Hardie;Lars Borin (ed.).  Parallel corpora, parallel worlds. Selected papers from a symposium on parallel and comparable corpora at Uppsala University, Sweden, 22–23 April, 1999 Amsterdam:  Rodopi,  2002. ii + 220?pp.  ISBN 90-420-1530-6;2006;;LANGUAGES IN CONTRAST
10.1075/lic.5.2.07sve;Jan Svennevig;Rod Gardner & Johannes Wagner (eds.).  Second Language Conversations London:  Continuum,  2004. x+292?pp.  ISBN 0-8264-6908-6 [Advances in Applied Linguistics].;2006;;LANGUAGES IN CONTRAST
10.1075/lic.5.2.08wik;Kay Wikberg;M.?A.?K. Halliday, Wolfgang Teubert, Colin Yallop & Anna ?erm?kov?.  Lexicology and Corpus Linguistics. An Introduction London:  Continuum,  2004.   ISBN 0-8264-4862-3pb;2006;;LANGUAGES IN CONTRAST
10.1075/lic.5.1.02aij;"Karin Aijmer; Hilde Hasselg?rd; Stig Johansson";Introduction;2005;;LANGUAGES IN CONTRAST
