doi;author;title;year;abstract;journal
10.1075/lic.12.2.02per;Javier P?rez-Guerra;A contrastive analysis of (English) ‘there’ and (Spanish) hay existential sentences: Towards a constructional prototype;2012;This study is devoted to the grammatical, semantic and informative analysis of the so-called existential sentence (“There is a girl in the garden” in English, or Hay una ni?a en el jard?n ‘There-is a girl in the garden’ in Spanish) in an attempt to establish a multi-linguistic prototype of the construction. To that end, data from several corpora of contemporary spoken English and Spanish are analysed in a number of ways, including the frequency of this construction in the two languages, the basic elements of its syntactic structure, and the semantic and informative constraints which operate in the existential/presentational construction. This study also deals with the degree of variation which these sentences exhibit and how this affects the selection of the marker of the construction (‘there’, hay), agreement between the marker or the verb and the postverbal noun phrase, the accommodation of additional constituents such as locative phrases or nominal postmodifiers and complements, the so-called indefiniteness restriction, and the compliance with general informative principles to which English and Spanish are claimed to be subject. A corpus-based contrastive methodology leads both to a prototypical and to a language-specific description of the existential construction in English and Spanish, in which the notion of grammatical, semantic and informative versatility plays a significant role.;LANGUAGES IN CONTRAST
10.1075/lic.12.2.03her;Jennifer Herriman;Existential constructions in English and Swedish;2012;Existential constructions introduce newsworthy information into the discourse by placing it in a position of prominence late in the message, in the Rheme. This study compares existential constructions in a sample of English and Swedish source texts and their translations in the English Swedish Parallel Corpus. The Swedish sample contains a slightly higher number of existential constructions. About two thirds are translated into or from existential constructions in the other language. The remaining correspondences differ somewhat in terms of where they place the newsworthy content presented by the notional subject in the existential construction. In English, this is often placed in the Theme. In Swedish, in contrast, this is usually avoided, either by fronting another clause element or by realizing the content as a complement or verb, which is placed in the Rheme. These findings provide further empirical evidence for the claim that Swedish follows the information principle more closely than English.;LANGUAGES IN CONTRAST
10.1075/lic.12.2.04izq;Marl?n Izquierdo;Corpus-based functionality and translatability: English–Spanish progressive constructions in contrast and translation;2012;This paper reports on a descriptive study of English and Spanish progressive constructions to identify degrees of common functionality and, therefore, translatability. Here, the functionality of the resource under study is examined contrastively, in order to observe functional correspondences which can be considered translation equivalents. In addition, a descriptive study of actual translations provides a broader picture of the degree of translatability between the languages under investigation. To this end, a corpus-based approach has been adopted to account for language usage in a cross-linguistic setting. Two complementary types of corpora have been used, a comparable corpus made up of BoE and CREA, and the ACTRES Parallel Corpus. The result constitutes a comprehensive approach to language description oriented towards application.;LANGUAGES IN CONTRAST
10.1075/lic.12.2.05sio;Athina Sioupi;A cross-linguistic investigation of the combinational possibilities of the ‘for X time’ adverbial with different aspectual verb classes;2012;The paper observes that the Vendler classification is not sufficient as a classification of verbs, since it cannot explain why some telic verbs, such as change of state (COS) verbs and degree achievements (DAs) appear with the durational adverbial (d-adverbial) ‘for X time’ in Greek, in English and in German, while some atelics like semelfactives appear with the frame adverbial (f-adverbial) se X ora (‘in X time’) in Greek. In the spirit of Iatridou et al. (2003) it is proposed that the d-adverbial ‘for X time’ tests not only for (a)telicity but also for (im)perfectivity. It also argues that the two d-adverbials in Greek ja X ora and epi X ora (‘for X time’) are to be found with different grammatical (viewpoint) aspect: the former with perfective aspect and the latter with imperfective aspect. This is due to the fact that the ja X ora gives not only durative temporal information but also a lexical aspectual one, while the epi X ora gives only a durative temporal.;LANGUAGES IN CONTRAST
10.1075/lic.12.2.06zuf;"Sandrine Zufferey; Bruno Cartoni";English and French causal connectives in contrast;2012;Discourse connectives are often said to be language specific, and therefore not easily paired with a translation equivalent in a target language. However, few studies have assessed the magnitude and the causes of these divergences. In this paper, we provide an overview of the similarities and discrepancies between causal connectives in two typologically related languages: English and French. We first discuss two criteria used in the literature to account for these differences: the notion of domains of use and the information status of the cause segment. We then test the validity of these criteria through an empirical contrastive study of causal connectives in English and French, performed on a bidirectional corpus. Our results indicate that French and English connectives have only partially overlapping profiles and that translation equivalents are adequately predicted by these two criteria.;LANGUAGES IN CONTRAST
10.1075/lic.12.2.08mik;Tamara Mikolic Juznic;A contrastive study of nominalization in the systemic functional framework;2012;This paper presents a contrastive analysis of nominalization in Italian and Slovene within the framework of systemic functional grammar as described by M.A.K. Halliday and his colleagues. Nominalization is viewed as a type of grammatical metaphor whereby processes which are congruently realized by verbs are metaphorically realized by nouns expressing the same process as those verbs. The frequency of nominalization varies greatly among languages as well as among genres within a language, and may cause problems when two languages interact, e.g. in translation, especially when one of the two languages seems less prone to use this kind of grammatical metaphor than the other. In the present study, an analysis is carried out of a 2.5 million-token parallel corpus of Italian source texts and their Slovene translations, particularly with regard to the different translation equivalents that may appear in the translated texts, which is partly dependent of the type of process involved.;LANGUAGES IN CONTRAST
10.1075/lic.12.2.07ban;David Banks;Pierre-Don Giancarli.  Les Auxiliaires ?tre et avoir. Etude compar?e corse, fran?ais, acadien et anglais Rennes:  Presses Universitaires de Rennes,  2011. 398?pp.  ISBN 978-2-7535-1370-9;2012;;LANGUAGES IN CONTRAST
10.1075/lic.12.1.02kon;Ekkehard K?nig;Contrastive linguistics and language comparison;2012;After receiving enthusiastic support during the 1960s and 1970s, the program of ‘Contrastive linguistics’ led a somewhat modest, if not marginal, existence during the two subsequent decades. The main reason for the apparent failure of this program was, of course, that the high hopes seen in its potential for making foreign language teaching more efficient were disappointed. Empirical work on the process of L2-acquisition from different native languages as starting points showed that contrastive linguistics cannot simply be equated with a theory of foreign language acquisition. A second problem was that a central aspect of the contrastive program, i.e. the writing of comprehensive contrastive grammars for language pairs, was hardly ever properly implemented. Finally, there was the problem of finding a place for contrastive linguistics within the spectrum of language comparison, relative to other comparative approaches to linguistic analysis. It is the third of these issues that is addressed by the present article. It will be shown that only by relating contrastive linguistics to other subfields of comparative linguistics and by delimiting it from them will we obtain a clear picture of its agenda, its potential and its limits.;LANGUAGES IN CONTRAST
10.1075/lic.12.1.03har;Wayne Harbert;Contrastive linguistics and language change: Reanalysis in Germanic relative clauses;2012;Contrastive linguistic studies have focused almost exclusively on contrasting the synchronic grammars of modern standard language varieties. There may be some merit in expanding the scope of the enterprise to include contrastive investigations of grammatical systems with respect to how they change over time. Full understanding of some contrasts between grammars requires reference to the diachronic axis. This paper illustrates the point with one particular case in the Germanic languages, involving parallel instances of reanalysis of relative pronouns as relative complementizers in Yiddish, Afrikaans and Gothic. These parallel changes, operating on grammatical systems with slight differences in initial conditions, yield sharply different outcomes.;LANGUAGES IN CONTRAST
10.1075/lic.12.1.04pol;Cecilia Poletto;Contrastive linguistics and micro-variation: The role of dialectology;2012;This article deals with a very general problem, namely the origin of the well-known distinction between dialectal and typological variation. It is argued that the fact that the possible grammatical choices are more restricted within a dialectal domain is not due to a supposed principled difference in the parameters that rule variation. Rather, they are a function of the originally unitary lexicon dialects share. If language variation is essentially located in the functional items, and they are derived from the same lexicon, then they will share some core properties that make dialectal variation so restricted. I propose that the fact that the lexicon is similar can give us clues about the internal structure of syntactically complex elements which are represented by a single word, like quantifiers, wh-items, modal verbs, etc. Within a homogenous domain, structural complexity correlates with a higher number of lexical roots: the higher the number of the lexical roots found, the more complex internal structure the functional item will display.;LANGUAGES IN CONTRAST
10.1075/lic.12.1.05auw;Johan van der Auwera;From contrastive linguistics to linguistic typology;2012;The paper looks back at Hawkins (1986), A comparative typology of English and German, and shows, on the basis of raising and human impersonal pronouns in English, Dutch and German, that contrastive linguistics can be viewed as a pilot study in typology. It also pleads for doing the contrastive linguistics of three languages rather than of two, not least because the third language can teach us something about the other two.;LANGUAGES IN CONTRAST
10.1075/lic.12.1.06wie;Daniel Wiechmann;Hans Boas.  Contrastive Studies in Construction Grammar Amsterdam/Philadelphia:  John Benjamins,  2010. vii + 244?pp.  ISBN 978 90 272 0432 5 [Constructional Approaches to Languages, 10].;2012;;LANGUAGES IN CONTRAST
10.1075/lic.12.1.07rie;Arndt Riester;Carsten Breul & Edward G?bbel (eds.).  Comparative and Contrastive Studies of Information Structure Amsterdam / Phildadelphia:  John Benjamins,  2010. xii + 306?pp.  ISBN 978 90 272 8784 7 [Linguistics Today, 165].;2012;;LANGUAGES IN CONTRAST
10.1075/lic.12.1.08sta;Katerina Stathi;John Leavitt.  Linguistic Relativities: Language Diversity and Modern Thought Cambridge:  Cambridge University Press,  2011. 256?pp.  ISBN 978-0521767828;2012;;LANGUAGES IN CONTRAST
10.1075/lic.12.1.09cal;Marcus Callies;Fanny Meunier, Sylvie De Cock, Ga?tanelle Gilquin & Magali Paquot (eds.).  A Taste for Corpora. In honour of Sylviane Granger  [Studies in Corpus Linguistics, 452011].  Amsterdam/Philadelphia:  John Benjamins,  . xv + 295?pp.  ISBN 978 90 272 0350 2;2012;;LANGUAGES IN CONTRAST
10.1075/lic.12.1.10ang;Mar?a de los ?ngeles G?mez Gonz?lez;Karin Aijmer (ed.).  Contrastive Pragmatics Amsterdam:  John Benjamins,  2011. 182?pp.  ISBN 978 90 272 2260 2 [Benjamins Current Topics, 30].;2012;;LANGUAGES IN CONTRAST
10.1075/lic.11.2.01xia;Richard Xiao;Word clusters and reformulation markers in Chinese and English: Implications for translation universal hypotheses;2011;This article presents a corpus-based contrastive study of word clusters and reformulation markers in Chinese and English, and discusses the implications of the findings for translation universal hypotheses. The study is based on three balanced comparable corpora which represent British English, native Chinese and translational Chinese in addition to an English-Chinese parallel corpus which provides a basis for comparing native and translated English and investigating explicitation in translation. Our results show that word clusters are substantially more common in translated Chinese, suggesting a tendency in translations to use fixed and semi-fixed recurring patterns in an attempt to achieve improved fluency. The more frequent use of word clusters, especially those of high frequency and high coverage in translational Chinese, is also likely to be a result of the influence of the English source language because word clusters are significantly more prevalent in native English in relation to native Chinese. Chinese and English tend to use reformulation markers of different styles while on the other hand, reformulation markers are generally more common in both translated English and translated Chinese than in their native counterparts, suggesting that reformulation markers function as a strategy for explicitation in translations, which tend to use oral, stylistically simpler forms than non-translated texts.;LANGUAGES IN CONTRAST
10.1075/lic.11.2.02man;Elena Manca;The analysis of meaning between language and culture in the tourism domain;2011;"The relationship between language and culture is an interplay between linguistic choices and cultural filters; if we accept that language is an expression of culture, i.e. of the beliefs, customs, behaviours and rituals constituting the cultural identity of a group of people, then it is crucial that phraseology and cultural features are not separated in the analysis and production of meaning. This paper aims to combine two different methodological approaches to the study of meaning (Manca 2008, 2009): the Corpus Linguistics approach within the framework of John Sinclair’s view of language (1991, 1996) and the Intercultural Studies approach based on Hall’s ([1976] 1989) theories and Katan’s (2004, 2006) framework of High and Low Context Cultures features in transactional communication. The two levels of analysis allow the researcher to carry out both a quantitative and qualitative analysis. Examples that show the validity of this combined approach will be derived from a number of corpora of different subsections of the British and Italian languages of tourism. We will see that the two cultures tend to adopt different types of promotion in terms of linguistic devices (for example use of concrete nouns vs. abstract nouns) and features of description along a continuum which sees at one extreme explicitness and simple facts and at the other extreme implicitness, feelings and opinions.";LANGUAGES IN CONTRAST
10.1075/lic.11.2.03wie;Daniel Wiechmann;Exploring probabilistic differences between genetically related languages;2011;The study proposes an analytical pipeline for quantitative corpus-based research in the domain of contrastive linguistic analysis. Specifically, it is proposed that a combination of conditional inference tree models for data exploration combined with subsequent statistical modeling via generalized linear models can help reveal and describe interesting contrasts between the languages under investigation. The main goal of this paper is to provide an approachable introduction into the rationale underlying these techniques and to illustrate their application on the basis of a contrastive analysis of English and German relative clause constructions.;LANGUAGES IN CONTRAST
10.1075/lic.11.2.04ure;"Jos? Manuel Ure?a G?mez-Moreno; Maribel Tercedor";Situated metaphor in scientific discourse: An English-Spanish contrastive study;2011;Cognitive linguists have finally agreed that metaphorical thought is the result of neither nature nor nurture, but a combination of both. Despite the acknowledgment of this dual grounding (Sinha, 1999), cross-linguistic studies addressing the significance of cultural factors to form specialised concepts through metaphor are still rare. Research is even scarcer when it comes to terminological resemblance metaphor. To fill this gap, this paper examines a set of resemblance metaphor term pairs in English and Spanish, which had been retrieved from a corpus of marine biology texts extracted from academic journals. Based on the analysis of these terms, we propose a typology of metaphors which classifies them according to their level of socio-cognitive situatedness. This typology shows that: (i) sensorimotor perception and sociocultural factors merge into a physical-social experience that shapes scientific knowledge through metaphor, and (ii) sociocognitive patterns involved in terminological metaphor formation give rise to inter-linguistic variation and commonalities.;LANGUAGES IN CONTRAST
10.1075/lic.11.2.05rod;Guillermo Rodr?guez;Why can’t the sun bloom roses in Spanish?: On the nature of some internally-caused changes of state;2011;Levin and Rappaport (1995) have proposed a binary classification for change of state verbs that revolves around the locus of cause for these changes: whether the cause is internal or external to the entity undergoing change. They claim this distinction is crosslinguistically viable and explains the syntactic behavior of these predicates. Based on work done by Smith (1970) and Wright (2001), this paper argues for an extension of Levin and Rappaport’s binary classification. Instead, I propose a continuum resulting from the analysis of corpora in English and Spanish for verbs that would enter the binary categories advanced by Levin and Rappaport. One of the problematic pairs of verbs for their classification when applied to Spanish, florecer ‘to bloom’ and marchitar(se) ‘to wilt’ is analyzed in detail. The continuum proposed here extends Levin and Rappaport’s categories and takes into account the locus of control of the change and whether external factors may be necessary conditions for the change to occur. In particular, this new focus can account for the presence or absence of the clitic se with some of the predicates in Spanish.;LANGUAGES IN CONTRAST
10.1075/lic.11.2.06awe;Witoslaw Awedyk;Eva Ogiermann.  On Apologizing in Negative and Positive Cultures John Benjamins Publishing Company,  2009. 296?pp.  ISBN 978-90-272-5435-1;2011;;LANGUAGES IN CONTRAST
10.1075/lic.11.2.07tho;Geoff Thompson;Wolfgang Teubert.  Meaning, Discourse and Society Cambridge:  Cambridge University Press,  2010. viii + 291?pp.  ISBN 978-0-521-88565-2;2011;;LANGUAGES IN CONTRAST
10.1075/lic.11.2.08fre;C?cile Fr?rot;Langues et textes en contraste  [Cahiers Sens public, n° 13–14].  Lyon:  Sens Public,  2010. 274?pp.  ISBN 978-2-9524947-4-8;2011;;LANGUAGES IN CONTRAST
10.1075/lic.11.2.09lef;Marie-Aude Lefer;Richard Xiao (ed.).  Using Corpora in Contrastive and Translation Studies Newcastle upon Tyne:  Cambridge Scholars Publishing,  2010. ix + 540?pp.  ISBN 978 1 4438 1755 4;2011;;LANGUAGES IN CONTRAST
10.1075/lic.11.1.01int;Erich Steiner;Stig Johansson’s “Between Scylla and Charybdis: On individual variation in translation”: Introduction;2011;;LANGUAGES IN CONTRAST
10.1075/lic.11.1.03joh;Stig Johansson;Between Scylla and Charybdis: On individual variation in translation;2011;;LANGUAGES IN CONTRAST
10.1075/lic.11.1.04ste;Julia Stelter;To pun or not to pun?: A contrastive study of paronomastic jokes in English and German;2011;This paper presents a contrastive analysis of puns in English and German based on a bilingual corpus of 2,400 jokes from published collections. The main assumption is that punning in the two languages differs in quantity and quality because of contrasts in morphosyntax, lexis and phonology. More precisely, given that the creation of most types of paronomastic jokes is considered to be facilitated in English, the English data set is expected to show a higher number and a greater variation of puns. However, a few manifestations of punning are assumed to occur particularly often in the German data. Seven hypotheses related to these predictions are tested. The most significant finding is that puns in the English set clearly outnumber puns in the German set.;LANGUAGES IN CONTRAST
10.1075/lic.11.1.05car;"Marta Carretero; Asunci?n Villamil-Touri?o";A contrastive study of verbs of remembering and forgetting in English and Spanish;2011;This article presents a contrastive study of the verbs REMEMBER, FORGET and REMIND and their Spanish equivalents RECORDAR, ACORDARSE and OLVIDAR(SE), from a broad systemic-functional perspective. Through a database built with occurrences obtained from authentic corpora, a quantitative analysis was carried out on these verbs in terms of spoken and written mode and a number of clausal factors: mood, syntax and semantics of the Phenomenon, voice, polarity, person and modality. These factors were considered both individually and in relation to one another. The analysis uncovered similarities in the use of the English and Spanish verbs and, more significantly, a number of differences, due to a diversity of factors such as mode, lexical distribution, grammatical features and type of discourse, as well as politeness and other pragmatic reasons.;LANGUAGES IN CONTRAST
10.1075/lic.11.1.06alh;"Lafi M. Alharbi; John M. Swales";Arabic and English abstracts in bilingual language science journals: Same or different?;2011;Although Arabic is a language with a long scholarly tradition, relatively little is known about the rhetorical and linguistic features of contemporary Arabic prose. In this paper, we examine 28 Arabic and English paired abstracts dealing with the language sciences drawn from three journals. The analysis shows in both sub-corpora little use of first person pronouns or promotional elements, and the move structures tended to be simple, often only background? findings. Differences between the two languages included greater use of rhetorical and metaphorical flourishes in some Arabic texts and increased attention to background knowledge in some of the English ones. These findings may be related to certain scholastic traditions in the Arab World and to the fact that Arab humanities journals have only recently required articles to be accompanied by abstracts.;LANGUAGES IN CONTRAST
10.1075/lic.11.1.07lef;"Marie-Aude Lefer; Bruno Cartoni";Prefixes in contrast: Towards a meaning-based contrastive methodology for lexical morphology;2011;This paper proposes a meaning-based contrastive methodology for the study of prefixation in English, French and Italian which is easily adaptable to other languages and word-formation processes. Our discussion centres on some of the central methodological and theoretical issues involved in contrastive lexical morphology, an area which, to date, has largely remained under-researched. Precise defining criteria for derivative (and prefix) status are presented in order to decide what counts as a derivative (or as a prefix) and what does not. Emphasis is also put on a fined-grained semantic tertium comparationis elaborated for the cross-linguistic investigation of lexical morphology and based on a six-tiered semantic categorisation, viz. location, evaluation, negation, quantity, modality, and inchoativity, most of which are further divided into finer subcategories. This macro-approach makes it possible to draw important generalisations about the use of word-formation devices across languages.;LANGUAGES IN CONTRAST
